{
  "hero": [
    {
      "original": "/assets/lab-group-2026.jpg",
      "display": "/assets/lab-group-2026-web.jpg",
      "width": 1920,
      "height": 1080,
      "altKey": "teamPhotoAlt",
      "captionKey": "heroLabCaption"
    },
    {
      "original": "/assets/lab-group-2025.jpg",
      "display": "/assets/lab-group-2025-web.jpg",
      "width": 1024,
      "height": 768,
      "altKey": "groupPhotoAlt",
      "captionKey": "heroTeamCaption"
    }
  ],
  "gallery": [
    {
      "url": "/assets/brand/silicon-based-tree-of-life.png",
      "altKey": "circuitTreeAlt",
      "captionKey": "siliconTreeTitle",
      "eyebrowKey": "labTotem",
      "descriptionKey": "siliconTreeDescription"
    }
  ],
  "newsLimit": 3,
  "publicationLimit": 4
}
